{"authority":{"approvalEventSha256":"sha256:2762f5819ed206d24abf435f4218cba4d05cfe8d458236598606a4d480c44eab","decisionId":"G-CONTRACT-AUTHORITY","decisionSha256":"sha256:0667406e1ccc23439e2fb48d0bb2faee1abe4f5d5e0ad9c4e82fabd3b73c415a","model":"WORKSPACE_PORTABLE_AUTHORITY_WITH_IMMUTABLE_GENERATED_CONSUMERS"},"canonicalization":{"algorithm":"RFC8785_JCS","conformanceVectors":{"nonNormalization":{"entries":[["é","NFC"],["é","NFD"]],"expectedCanonical":"{\"é\":\"NFD\",\"é\":\"NFC\"}"},"numberVectors":[{"expected":"0","ieee754Hex":"0000000000000000"},{"expected":"0","ieee754Hex":"8000000000000000"},{"expected":"5e-324","ieee754Hex":"0000000000000001"},{"expected":"-5e-324","ieee754Hex":"8000000000000001"},{"expected":"1.7976931348623157e+308","ieee754Hex":"7fefffffffffffff"},{"expected":"-1.7976931348623157e+308","ieee754Hex":"ffefffffffffffff"},{"expected":"9007199254740992","ieee754Hex":"4340000000000000"},{"expected":"-9007199254740992","ieee754Hex":"c340000000000000"},{"expected":"295147905179352830000","ieee754Hex":"4430000000000000"},{"ieee754Hex":"7fffffffffffffff","reject":"non-finite"},{"ieee754Hex":"7ff0000000000000","reject":"non-finite"},{"ieee754Hex":"fff0000000000000","reject":"non-finite"},{"expected":"9.999999999999997e+22","ieee754Hex":"44b52d02c7e14af5"},{"expected":"1e+23","ieee754Hex":"44b52d02c7e14af6"},{"expected":"1.0000000000000001e+23","ieee754Hex":"44b52d02c7e14af7"},{"expected":"999999999999999700000","ieee754Hex":"444b1ae4d6e2ef4e"},{"expected":"999999999999999900000","ieee754Hex":"444b1ae4d6e2ef4f"},{"expected":"1e+21","ieee754Hex":"444b1ae4d6e2ef50"},{"expected":"9.999999999999997e-7","ieee754Hex":"3eb0c6f7a0b5ed8c"},{"expected":"0.000001","ieee754Hex":"3eb0c6f7a0b5ed8d"},{"expected":"333333333.3333332","ieee754Hex":"41b3de4355555553"},{"expected":"333333333.33333325","ieee754Hex":"41b3de4355555554"},{"expected":"333333333.3333333","ieee754Hex":"41b3de4355555555"},{"expected":"333333333.3333334","ieee754Hex":"41b3de4355555556"},{"expected":"333333333.33333343","ieee754Hex":"41b3de4355555557"},{"expected":"-0.0000033333333333333333","ieee754Hex":"becbf647612f3696"},{"expected":"1424953923781206.2","ieee754Hex":"43143ff3c1cb0959"}],"permutations":{"expectedCanonical":"{\"a\":{\"x\":1,\"y\":2},\"list\":[{\"a\":1,\"b\":2},3],\"z\":0}","inputs":["{\"z\":0,\"a\":{\"y\":2,\"x\":1},\"list\":[{\"b\":2,\"a\":1},3]}","{\"list\":[{\"a\":1,\"b\":2},3],\"a\":{\"x\":1,\"y\":2},\"z\":0}","{\"a\":{\"x\":1,\"y\":2},\"z\":0,\"list\":[{\"b\":2,\"a\":1},3]}"]},"primitiveExample":{"expectedCanonical":"{\"literals\":[null,true,false],\"numbers\":[333333333.3333333,1e+30,4.5,0.002,1e-27],\"string\":\"€$\\u000f\\nA'B\\\"\\\\\\\\\\\"/\"}","inputJson":"{\"numbers\":[333333333.33333329,1E30,4.50,2e-3,0.000000000000000000000000001],\"string\":\"\\u20ac$\\u000F\\u000aA'\\u0042\\u0022\\u005c\\\\\\\"\\/\",\"literals\":[null,true,false]}"},"schemaVersion":1,"source":"RFC 8785 sections 3.2.2, 3.2.3, and Appendix B","utf16Ordering":{"entries":[["€","Euro Sign"],["\r","Carriage Return"],["דּ","Hebrew Letter Dalet With Dagesh"],["1","One"],["😀","Emoji: Grinning Face"],["","Control"],["ö","Latin Small Letter O With Diaeresis"]],"expectedCanonical":"{\"\\r\":\"Carriage Return\",\"1\":\"One\",\"\":\"Control\",\"ö\":\"Latin Small Letter O With Diaeresis\",\"€\":\"Euro Sign\",\"😀\":\"Emoji: Grinning Face\",\"דּ\":\"Hebrew Letter Dalet With Dagesh\"}"}},"digestAlgorithm":"SHA-256","strictIngestionRejectionVectors":{"cases":[{"code":"DUPLICATE_PROPERTY","name":"literal duplicate property","utf8":"{\"a\":1,\"a\":2}"},{"code":"DUPLICATE_PROPERTY","name":"escape-equivalent duplicate property","utf8":"{\"a\":1,\"\\u0061\":2}"},{"code":"DUPLICATE_PROPERTY","name":"surrogate-pair-equivalent duplicate property","utf8":"{\"😀\":1,\"\\ud83d\\ude00\":2}"},{"code":"NEGATIVE_ZERO","name":"raw minus zero","utf8":"-0"},{"code":"NEGATIVE_ZERO","name":"fractional spelling of minus zero","utf8":"-0.0"},{"code":"NEGATIVE_ZERO","name":"exponent spelling of minus zero","utf8":"-0e+10"},{"basis":"CERAGON_SAFE_INTEGER_POLICY","code":"UNSAFE_INTEGER","name":"unsafe positive integer","utf8":"9007199254740992"},{"basis":"CERAGON_SAFE_INTEGER_POLICY","code":"UNSAFE_INTEGER","name":"unsafe negative integer","utf8":"-9007199254740992"},{"basis":"CERAGON_SAFE_INTEGER_POLICY","code":"UNSAFE_INTEGER","name":"unsafe integral exponent","utf8":"9.007199254740992e15"},{"code":"NON_FINITE_NUMBER","name":"number outside binary64 range","utf8":"1e400"},{"code":"LONE_SURROGATE","name":"lone high surrogate escape","utf8":"{\"x\":\"\\ud800\"}"},{"code":"LONE_SURROGATE","name":"lone low surrogate escape","utf8":"{\"x\":\"\\udc00\"}"},{"code":"LONE_SURROGATE","name":"reversed surrogate escapes","utf8":"{\"x\":\"\\udc00\\ud800\"}"},{"code":"NONCHARACTER","hex":"7b2278223a22efb790227d","name":"raw BMP noncharacter"},{"code":"NONCHARACTER","name":"escaped BMP plane-end noncharacter","utf8":"{\"x\":\"\\uffff\"}"},{"code":"NONCHARACTER","name":"escaped supplementary plane-end noncharacter","utf8":"{\"x\":\"\\ud83f\\udffe\"}"},{"code":"NONCHARACTER","name":"escaped noncharacter member name","utf8":"{\"\\ufdd0\":true}"},{"code":"BOM_NOT_ALLOWED","hex":"efbbbf7b7d","name":"leading BOM"},{"code":"INVALID_UTF8","hex":"7b2278223a22c328227d","name":"invalid UTF-8 continuation"},{"code":"INVALID_UTF8","hex":"7b2278223a22c0af227d","name":"overlong UTF-8"},{"code":"INVALID_UTF8","hex":"7b2278223a22eda080227d","name":"UTF-8 encoded surrogate"},{"code":"SYNTAX_ERROR","name":"trailing token","utf8":"{}[]"},{"code":"SYNTAX_ERROR","hex":"7b2278223a220a227d","name":"unescaped control"}],"profile":"Ceragon strict UTF-8 JCS ingestion: RFC 8785/I-JSON plus mandatory safe-integral-value policy","schemaVersion":1}},"deferredContractSections":{"failureOracle":"P0-F01","fourAxisRuntimeTruth":"P0-E01","obligationUnion":"P0-O01","signingAndTrust":"P0-S01"},"format":"ceragon.ai-security.portable-contract","formatVersion":1,"generator":{"name":"ceragon-ai-security-artifact","version":"1.0.0"},"package":{"name":"@ceragon/shared-contracts","version":"0.2.0"},"protocol":{"readableVersions":["1","2"],"v2WriterEnabled":false,"writableVersions":["1"]},"requiredIntegrationGate":"P0-C07","runtimeActivatable":false,"signedRuntimePolicyBundle":false,"v1Policy":{"authorityProof":{"authoritativeSources":{"Backend/src/ai-governance/services/ai-policy.service.ts":"f77bc6f7651af0db23cb57aa306ea976852413adbe24c1cb86008e7255b223b6","Backend/src/ai-security-policy/ai-security-policy.constants.ts":"49d077c7b62b74751c5515d2f56deeea78f15f913cecad848957c2469aff346b","Backend/src/ai-security-policy/ai-security-policy.service.ts":"92ca68f437c4e46946bbbb91a4b0ae895d8cfaf39cdb21804c04ef9e76af78d8","Backend/src/ai-security-policy/dto/ai-security-policy.dto.ts":"724fcea622ac37f3739b4bd8b2d140b370a4009d1b18ceadecf8c7deeb5a25df","Installers/internal/aiagent/aiagent.go":"1732b70eb3cf9d28af7a700bb1a6a320c3c97c7fe30e619f229052e5827b28aa","Installers/internal/core/backend/ai_prompt.go":"756368f5906778e04674566d401b6ed8898ee5f7b2a8cdfdcaabd5f09a8a18cb","Installers/internal/daemon/ai_handlers.go":"fe64d5e877ed46ae1a6d11d650a729b294c3223d52f283b467d0bfeb1ce08115","Installers/internal/daemon/ai_ingress.go":"7d9873f17cfb614e6812a9735796d056584f2c035ceedd6688a063d4c033b61c","Installers/internal/daemon/openai_wire.go":"0d2335a69a277755897154755458cc089575e9d209362ada7aef2366e5d8075b","Installers/internal/daemon/server.go":"8bc9ab82d0e79f4feace67ce14e4fedeec6bc02d39f23a5f01dceb7a309db6ad","Installers/internal/policybundle/bundle.go":"82284e569afcf68c28d5d6a9f6f2c5cc321027fcf765c41986d892a84ea174d2","Installers/internal/policyeval/policyeval.go":"22ff2a1fa1e2d7d2d8b01d55455af0b8119fdc231e09b598974b4cd1e5099fb2","Installers/internal/proxy/ai_egress.go":"7f43bbdc601619db83313b131088b3a00add5ffe6c0636100a92fc21ec70b105","Installers/internal/proxy/ai_ingress.go":"e903e8a9bb4495beb25f8fc324d531378fb0b6635fe8830336299af9bf5e52fc","Installers/internal/proxy/ai_proxy.go":"cec5a784028104ce35321944e4f092ee615b427a460738b8f494f19857939276","Installers/internal/proxy/openai_decision.go":"40810cb67e3eac6dd3c0f600a1be2473428a0b887bdd0ad1aec924d76c00d393","Workspace/packages/shared-contracts/src/ai-governance-contract.ts":"a2bc438b0b6f08b14fc56948b0104bb70e35cc69ec63d23aa6b753a8e805e2cc"},"capturedControlPlaneSotSha256":"023bb89f1bac4e1f2a3eff42f630d0697841f9d3adea0e2e340cc08721c829a6","schemaVersion":1,"wireFixtures":{"effectiveNoTeam":{"agents":{"allowed":[],"enforcementTier":"detect","mode":""},"blockedProviders":["openai"],"dlp":{"actions":{"anthropic-key":"redact","aws-access-key":"redact","aws-secret-key":"block","azure-key":"redact","db-connection-string":"warn","gcp-key":"redact","generic-api-key":"redact","github-token":"redact","gitlab-token":"redact","google-oauth-secret":"redact","high-entropy":"warn","internal-url":"redact","jwt":"redact","kubeconfig":"warn","npm-token":"redact","openai-key":"redact","private-key":"block","pypi-token":"redact","sendgrid-key":"redact","slack-token":"redact","slack-webhook":"redact","stripe-live":"redact","twilio-key":"redact"},"blockClasses":["private-key","aws-secret-key"],"enabled":true,"redactClasses":["aws-access-key","gcp-key","azure-key","generic-api-key","jwt","slack-token","github-token","internal-url","openai-key","anthropic-key","stripe-live","slack-webhook","sendgrid-key","twilio-key","npm-token","pypi-token","gitlab-token","google-oauth-secret"],"warnClasses":["high-entropy","kubeconfig","db-connection-string"]},"egress":{"allowed":[],"blocked":[],"includeDefaults":true,"mode":""},"evidenceMode":"HASH_ONLY","exclusions":{"allow":["fixture-allow-marker"],"block":["fixture-block-marker"],"patterns":[{"action":"allow","prefix":"fixture-prefix","suffix":"fixture-suffix"}]},"mcp":{"autoEnforce":false,"enabled":true},"paths":{"allowed":["/fixture/allowed"],"blocked":["/fixture/restricted"]},"promptRisk":{"actions":{"injection-encoded-payload":"warn","injection-instruction-override":"warn","injection-obf